,speaker,sentence
199,CHAIR POWELL,"Sufficiently—so I think, you know, what, what we’d like to see is credible evidence that inflation is topping out and then beginning to come down."
200,CHAIR POWELL,"That’s, that’s what we want to see—of course that’s what we want to see."
201,CHAIR POWELL,"And I, I think it’s—it’s also—we understand that there are lags, but remember that it’s, it’s more than a year since financial conditions began tightening."
202,CHAIR POWELL,"I think it’s—I think the reason we’re, we’re comfortable pausing is that we are still—much of the tightening took place over last summer and later into the year."
203,CHAIR POWELL,"And I think it’s, it’s reasonable to think that some of that may come into effect."
204,CHAIR POWELL,"So we’re, you know—I think stretching out into a more moderate pace is appropriate to, to allow you to make that judgment of sufficiency, you know, more—with more data over time."
205,MICHELLE SMITH,Rachel.
206,RACHEL SIEGEL,"Hi, Chair Powell."
207,RACHEL SIEGEL,Rachel Siegel from the Washington Post.
208,RACHEL SIEGEL,Thanks for taking our questions.
209,RACHEL SIEGEL,"I wanted to ask further on the lag effects—when you’re considering when you would hike again throughout the course of the year, are there things that you would expect to kick in as those lag effects come, come into effect that would inform your decisions?"
210,RACHEL SIEGEL,Have you learned things over the past year that give you some sense of timeline for when to expect those lags to come into effect?
211,CHAIR POWELL,Yeah.
212,CHAIR POWELL,"So it’s a—it’s a challenging thing in, in economics."
213,CHAIR POWELL,"It’s, it’s sort of standard thinking that monetary policy affects economic activity with long and variable lags."
214,CHAIR POWELL,"Of course, these days, financial conditions begin to tighten well in advance of actual rate hikes."
215,CHAIR POWELL,"So if you—if you look back when we were lifting off, we started talking about lifting off—by the time we had lifted off, the two-year [interest rate], which is a pretty good estimate of where [monetary] policy is going, had gone from 20 basis points to 200 basis points."
216,CHAIR POWELL,"So in that sense, tightening happens much sooner than it used to in a world where—where news was in newspapers and not, you know, not on, on the wire."
217,CHAIR POWELL,"So that’s, that’s different."
218,CHAIR POWELL,"But it’s still the case that what you see is interest-sensitive spending is affected very, very quickly—so housing, and durable goods, and things like that."
219,CHAIR POWELL,"But broader demand, and spending, and, and asset values, and things like that—they just take longer."
220,CHAIR POWELL,And you can pretty much find research to support whatever answer you would like on that.
221,CHAIR POWELL,So there’s not any certainty or agreement in the profession on how long it takes.
222,CHAIR POWELL,"So, you know, then that makes it challenging, of course."
223,CHAIR POWELL,"So we’re, we’re looking at the calendar."
224,CHAIR POWELL,"We’re, we’re looking at what’s happening in the economy."
225,CHAIR POWELL,We’re having to make these judgments.
226,CHAIR POWELL,"Again, it’s one of the main reasons why it makes sense to go at a slightly more moderate pace now as we seek that, that ultimate—I can’t point to—that ultimate endpoint."
227,CHAIR POWELL,I can’t point to a specific data point.
228,CHAIR POWELL,"I think we’ll see it when we see inflation, you know, really, really flattening out reliably and then starting to soften."
229,CHAIR POWELL,I think we’ll know that we’re—that it’s working.
230,CHAIR POWELL,"And, ideally, by, by taking a little more time, we won’t go well past the level where we need to go."
231,RACHEL SIEGEL,I was curious if you could give us an update on what you’re seeing on credit tightening since the bank incidents for March and how you’re teasing that out apart from these lag effects.
232,CHAIR POWELL,"So it’s, it’s too early still to, to try to assess the full extent of what that might mean."
233,CHAIR POWELL,"And, you know, that’s something we’re going to be watching, of course."
234,CHAIR POWELL,"And, you know, if we were to see what, what we would view as significant tightening beyond what would normally be expected because of, of this channel, then, you know, we would factor that into account on, on—in, in making rate decisions."
235,CHAIR POWELL,"So that’s, that’s how we think about it."
236,MICHELLE SMITH,Let’s go to Chris.
237,CHRIS RUGABER,Thanks.
238,CHRIS RUGABER,Chris Rugaber at Associated Press.
239,CHRIS RUGABER,You mentioned that many of the trends are in place that you want to see—core services ex.
240,CHRIS RUGABER,housing has come in pretty low in the past couple of months.
241,CHRIS RUGABER,"And, as you noted, a significant portion of core inflation is now housing prices."
242,CHRIS RUGABER,And then we’ve had some quirks in used-car prices.
243,CHRIS RUGABER,"So given that these trends are in place, I guess I’m sort of asking the flip side of Nick’s question: Why signal additional rate hikes?"
244,CHRIS RUGABER,Aren’t things headed in the direction you need?
245,CHRIS RUGABER,Why not simply give it even more time?
246,CHRIS RUGABER,"Or—it’s surprising to see so much hawkishness in the dots, given what we’re seeing recently."
247,CHAIR POWELL,Yeah.
248,CHAIR POWELL,"So, you know, we’ve—remember, we’ve—we’re two and a half years into this—or two and a quarter years into this."
249,CHAIR POWELL,"And forecasters, including Fed forecasters, have consistently thought that inflation was about to turn down and, you know, traditional—you know, typically forecasted that it would and been wrong."
250,CHAIR POWELL,So I think if you—I think if you look at the—at core PCE inflation overall—look at it over the last six months—you’re just not seeing a lot of progress.
251,CHAIR POWELL,"It’s running, and it’s running June 14, 2023 at a level, you know, over 4½ percent—far above our, our target and not really, you know, Chair Powell’s Press Conference FINAL moving down."
252,CHAIR POWELL,We want to see it moving down decisively.
253,CHAIR POWELL,That’s all.
254,CHAIR POWELL,"We’re, you know, of course, we’re going to get inflation down to 2 percent over time."
255,CHAIR POWELL,"We, we don’t want to do—we, we want to do that with the minimum damage we can to the economy, of course."
256,CHAIR POWELL,"But we have to get inflation down to 2 percent, and we will."
257,CHAIR POWELL,And we just don’t see that yet.
258,CHAIR POWELL,"So, hence, you see today’s policy decision: both, both to write down further rate hikes by the end of this year but also to, you know, to take—to, to moderate somewhat the pace with which we’re moving."
259,CHRIS RUGABER,Quick follow-up.
260,CHRIS RUGABER,"I mean, the last press conference you mentioned you didn’t see wages driving inflation."
261,CHRIS RUGABER,"And, you know, there was some research from the San Francisco Fed suggesting wages aren’t necessarily a key driver."
262,CHRIS RUGABER,But you’ve talked about the labor market today and the need for softening.
263,CHRIS RUGABER,"Can you give us a little more, specifically, of how you see the tight labor market driving inflation at this point?"
264,CHRIS RUGABER,Thank you.
265,CHAIR POWELL,Right.
266,CHAIR POWELL,"So I’m, I’m not going to comment on any particular paper, but I, I would say that the—I think the overall picture is that at the beginning in, you know, early 2021, inflation was really becoming from very strong demand for—largely for goods."
267,CHAIR POWELL,People were still at home.
268,CHAIR POWELL,"They had money in the bank, and they wanted to spend—they spent a lot on goods."
269,CHAIR POWELL,"And, of course, at the same time—and because of that high demand, to some extent, supply chains got all snarled up."
270,CHAIR POWELL,So prices went way up.
271,CHAIR POWELL,Inflation went way up.
272,CHAIR POWELL,"So that was the, the origin, and it wasn’t really particularly about the labor market or wages."
273,CHAIR POWELL,"But as you—as you moved into—through ’21, into ’22, and now in ’23, I think many, many analysts believe that it will be important—an important part of getting inflation down, especially in the nonhousing June 14, 2023 services sector, to getting wage inflation back to a level that is sustainable, that is consistent with Chair Powell’s Press Conference FINAL 2 percent inflation."
274,CHAIR POWELL,We actually have seen wages broadly move down but just at a quite gradual pace.
275,CHAIR POWELL,"So—and that’s, you know, that’s a little bit of the finding of the Bernanke paper with Blanchard of a few weeks ago, which is very consistent with, with what I, I would think."
276,MICHELLE SMITH,Let’s go to Michael McKee.
277,MICHAEL MCKEE,Michael McKee from Bloomberg Radio and Television.
278,MICHAEL MCKEE,You said in the past that you don’t like to surprise markets.
279,MICHAEL MCKEE,It’s kind of been the Fed’s view markets should have an idea of what you’re going to do before you go in.
280,MICHAEL MCKEE,You also said a number of times that it would take a while to bring inflation down.
281,MICHAEL MCKEE,"You reiterated that again today and that we, we’d get to a point where inflation could be sticky."
282,MICHAEL MCKEE,"So I’m wondering, as we go into the next meetings, how Wall Street or others should look at your reaction function."
283,MICHAEL MCKEE,What will you be reacting to—time or data?
284,MICHAEL MCKEE,"In other words, if nothing much changes—if we’re looking at the same sort of labor market, the same sort of inflation levels in July or in September or November—will you move because you’ve said you feel you need to?"
285,MICHAEL MCKEE,"Is it time that’s going to require additional movement, or would it be reversal in inflation?"
286,CHAIR POWELL,"So I, I don’t want to deal with, with hypotheticals about different ways data might move."
287,CHAIR POWELL,"And so, we, you know—we of course—we’re not—we don’t go out of our way to surprise markets or the public."
288,CHAIR POWELL,"At the same time, our main focus has to be on getting the policy right."
289,CHAIR POWELL,"And that’s, that’s what we’re doing here, and that’s what we’ll do for the upcoming meetings."
290,CHAIR POWELL,"I will say the July meeting will be “live,” and we’ll just have to see."
291,CHAIR POWELL,"I think you’ll, you’ll see the data, you’ll hear Fed people talking about it, and, and markets will have to make a—make a judgment."
292,MICHAEL MCKEE,"Well, do you think inflation is likely to continue coming down based on the lags and based on your threat of additional movement?"
293,MICHAEL MCKEE,Or are we going to be in a period where we’re not going to know what’s happening?
294,CHAIR POWELL,"You know, I, I think if you look at—if, if you just look at—I’ll just point you to the forecast."
295,CHAIR POWELL,"So inflation is running—core PCE inflation is running at about 4½, a little higher than 4½ percent."
296,CHAIR POWELL,"And the, the median FOMC participant thinks it will go down to 3.9 on a 12-month basis."
297,CHAIR POWELL,This is by the end of this year.
298,CHAIR POWELL,So that’s expecting pretty substantial progress.
299,CHAIR POWELL,"That’s, that’s a pretty significant decline for half a year."
300,CHAIR POWELL,"So that’s, that’s the forecast."
301,CHAIR POWELL,"You know, we’ll—we do try to be transparent in our reaction function."
302,CHAIR POWELL,"We’re, we’re committed to getting inflation down."
303,CHAIR POWELL,And that’s the number-one thing.
304,CHAIR POWELL,So that’s how I think about it.
305,MICHELLE SMITH,Let’s go to Victoria.
306,VICTORIA GUIDA,Victoria Guida with Politico.
307,VICTORIA GUIDA,Could you talk about the balance sheet and how you’re thinking about it?
308,VICTORIA GUIDA,"What, what are you looking for to judge whether we’re approaching reserve scarcity?"
309,VICTORIA GUIDA,And is Treasury issuance going to affect that?
310,VICTORIA GUIDA,"Also, are you considering lowering the RRP rate in order to take some pressure off banks?"
311,CHAIR POWELL,"So let me say, first of all, on the Treasury part of it—if I can talk about that and then go back to the balance sheet."
312,CHAIR POWELL,"So on that—of course, we’ve been very focused on that for a couple of months, as everyone has."
313,CHAIR POWELL,[The] Treasury has laid out its borrowing plans publicly.
314,CHAIR POWELL,"I think we all saw—I saw the Secretary’s comments yesterday to the June 14, 2023 effect that [the] Treasury has consulted widely with market participants about how to avoid Chair Powell’s Press Conference FINAL market disruption and that they’re going to watch carefully for that."
315,CHAIR POWELL,"So that’s, that’s from the Treasury, which actually sets the, you know, the, the borrowings."
316,CHAIR POWELL,"At the Fed, we’ll be monitoring market conditions carefully as the Treasury refills the, the TGA."
317,CHAIR POWELL,The adjustment process is very likely to involve both a reduction in the RRP facility and also in reserves.
318,CHAIR POWELL,It’s really hard to say at the—at the beginning of this which will be—which will be greater.
319,CHAIR POWELL,"We are starting at a very high level of reserves—and still elevated over RRP take-up, for that matter—so we don’t think reserves are likely to become scarce in the near term or even over the course of the year."
320,CHAIR POWELL,"So that’s, that’s—that’s the—that’s the Treasury part of the answer."
321,CHAIR POWELL,"We will, of course, continue to monitor conditions in money markets, and we’re prepared to make adjustments to make sure that, that monetary policy transmission works."
322,CHAIR POWELL,Was there another part of your question?
323,VICTORIA GUIDA,Yeah—are you considering lowering the RRP rate to help take some pressure off banks?
324,CHAIR POWELL,"So we, we have a number of—I would say the [ON] RRP [facility] doesn’t look like it’s, it’s pulling money out of—out of the banking system."
325,CHAIR POWELL,It’s actually been shrinking here lately.
326,CHAIR POWELL,"So I don’t think—that’s not something, something we’ve thought about a lot over time."
327,CHAIR POWELL,"It doesn’t really look like that’s, that’s something that we would do."
328,CHAIR POWELL,I think it’s—I think it’s a tool that we have.
329,CHAIR POWELL,"If we want to use it, we can."
330,CHAIR POWELL,There are other tools we can—we can use to address money market issues.
331,CHAIR POWELL,But I wouldn’t say that that’s something that’s likely that we would do in the near term.
332,MICHELLE SMITH,Jonnelle.
333,JONNELLE MARTE,Jonnelle Marte with Bloomberg.
334,JONNELLE MARTE,Have you seen sufficient cooling in the housing market to bring inflation down?
335,JONNELLE MARTE,"For example, how does the recent rebound affect your forecasts, and how does it factor into monetary policy?"
336,CHAIR POWELL,"So certainly housing—very interest sensitive, and it’s the first place, really, or one of the first places, that’s either helped by low rates or, or that is held back by, by higher rates."
337,CHAIR POWELL,And we certainly saw that over the course of the last year.
338,CHAIR POWELL,We now see housing putting in a bottom and maybe even moving up a little bit.
339,CHAIR POWELL,"You know, we’re watching that situation carefully."
340,CHAIR POWELL,"I do think we—we will see rents, rents and, and house prices filtering into, into housing services inflation."
341,CHAIR POWELL,"And I, I don’t see them coming up quickly."
342,CHAIR POWELL,"I, I do see them kind of—kind of wandering around at a relatively low level now, and that’s appropriate."
343,JONNELLE MARTE,Do you think you’ll have to target that with further rate increases?
344,CHAIR POWELL,"Well, I think we, we look at everything."
345,CHAIR POWELL,We don’t just look at housing.
346,CHAIR POWELL,"So I think, you know, the way it works is the individual participants sit in their offices all over the country, and they write down their forecast and—including their most likely forecasts—including their rate forecast."
347,CHAIR POWELL,"And then they send it in on Friday afternoon, and we cumulate it, and then we publish it for you."
348,CHAIR POWELL,So that’s how—that’s how they do that.
349,CHAIR POWELL,"Well, I don’t know that housing is, is itself going to be driving the rates picture, but it’s part of it."
350,MICHELLE SMITH,Let’s go to Edward.
351,EDWARD LAWRENCE,"Thank you for taking the question, Mr. Chairman."
352,EDWARD LAWRENCE,Edward Lawrence with Fox Business.
353,EDWARD LAWRENCE,"So I want to go back to comments you made about, in the past, June 14, 2023 about unsustainable fiscal path."
354,EDWARD LAWRENCE,The CBO projects the federal deficit to be $2.8 trillion in Chair Powell’s Press Conference FINAL 10 years.
355,EDWARD LAWRENCE,The CBO also says that federal debt will be $52 trillion by 2033.
356,EDWARD LAWRENCE,At what point do you talk more firmly with lawmakers about fiscal responsibility?
357,EDWARD LAWRENCE,Because—assuming monetary policy cannot handle alone the inflation or keep that inflation in check with the higher-level spending.
358,CHAIR POWELL,I don’t do that.
359,CHAIR POWELL,That’s really not my job.
360,CHAIR POWELL,"We—we hope and expect that other policymakers will respect our independence on, on monetary policy."
361,CHAIR POWELL,"And we don’t see ourselves as, as, you know, the judges of appropriate fiscal policy."
362,CHAIR POWELL,"I will say, and many of my predecessors have said, that we’re on an unsustainable fiscal path and, and that needs to be addressed over time."
363,CHAIR POWELL,"But I think trying to get into, into that with lawmakers would be—would be kind of inappropriate, given our independence and our need to stick to our knitting."
364,EDWARD LAWRENCE,Is there any conversation then about the Federal Reserve financing some of that debt that we’re seeing coming down the pike?
365,CHAIR POWELL,No.
366,CHAIR POWELL,Under no circumstances.
367,MICHELLE SMITH,Courtenay.
368,COURTENAY BROWN,"Thanks for taking our questions, Chair Powell."
369,COURTENAY BROWN,"So looking at the SEP, it looks like GDP for this year was raised significantly—your forecast for GDP this year."
370,COURTENAY BROWN,"The unemployment rate, meanwhile, was pulled downward."
371,COURTENAY BROWN,"And so should we take that as a sign that the Committee is more confident about the prospects of a soft landing—at least more—at least as it relates to what you were expecting in, in March?"
372,CHAIR POWELL,"You know, I—I would just say it this way."
373,CHAIR POWELL,"I continue to think—and this really hasn’t changed—that there is a path to getting inflation back down to 2 percent without having to see the kind of sharp downturn and, and large losses of employment that we’ve June 14, 2023 seen in so many past instances."
374,CHAIR POWELL,"It’s, it’s possible."
375,CHAIR POWELL,"A—in a way, a strong labor market is—that, Chair Powell’s Press Conference FINAL that gradually cools could, could aid that along—it could aid that along."
376,CHAIR POWELL,"But I, I guess I want to come back to the, the main thing, which is, though, simply this."
377,CHAIR POWELL,"We, we see—the Committee—as you can see from the SEP, the Committee is completely unified in the need to get inflation down to 2 percent and will do whatever it takes to get it down to 2 percent over time."
378,CHAIR POWELL,That is our plan.
379,CHAIR POWELL,"And, you know, we, we understand that allowing inflation to get entrenched into the—in the U.S. economy is the thing that we cannot, cannot allow to happen for the benefit of today’s workers and families and businesses but also for the future."
380,CHAIR POWELL,"Getting price stability back and, and restored will benefit generations of people as long as it’s sustained."
381,CHAIR POWELL,And it really is the bedrock of the economy.
382,CHAIR POWELL,"And, and you should understand that that is our top priority."
383,COURTENAY BROWN,Just a quick follow-up on that.
384,COURTENAY BROWN,"I’m just a little confused because you said the Committee will do whatever it takes to get inflation down over time, but when I look at the SEP, inflation is still projected to be elevated next year, but the fed funds rate is lower than where it is now."
385,COURTENAY BROWN,Can you help me understand that?
386,CHAIR POWELL,Sure.
387,CHAIR POWELL,"So, you know, if you look two and three years out with, with the forecast—first of all, I wouldn’t—I wouldn’t put too much weight on forecasts even one year out because they’re, they’re so highly uncertain."
388,CHAIR POWELL,"But what they’re showing is that as inflation comes down in the—in the forecast, if you don’t lower interest rates, then real rates are actually going up, right?"
389,CHAIR POWELL,"So just to maintain a real rate, the nominal rate at that point—two years out, let’s say—should come down just to maintain real rates."
390,CHAIR POWELL,"And if—and actually, you know, since we’re, we’re probably going to—we’re, we’re having real rates that are going to have to be meaningfully positive and significantly."
391,CHAIR POWELL,"So for us to get inflation down, that probably means—that, that certainly means that, that it will be appropriate to cut rates at such time as inflation is June 14, 2023 coming down really significantly."
392,CHAIR POWELL,"And again, we’re talking about a couple of years out."
393,CHAIR POWELL,"I think, Chair Powell’s Press Conference FINAL as, as anyone can see, not a single person on the Committee wrote down a rate cut this year, nor do I think it is at all likely to be appropriate, if you think about it."
394,CHAIR POWELL,Inflation has not really moved down.
395,CHAIR POWELL,It has—it has not so far reacted much to our—to our existing rate hikes.
396,CHAIR POWELL,And so we’re going have to keep at it.
397,MICHELLE SMITH,Julie.
398,JULIE CHABANAS,I’m sorry.
399,JULIE CHABANAS,Thank you.
400,JULIE CHABANAS,"Hi, Chair Powell."
401,JULIE CHABANAS,"Julie Chabanas, AFP News Agency."
402,JULIE CHABANAS,The May job report showed a rebound in May in the Black workers’ unemployment.
403,JULIE CHABANAS,Is it consistent with the Fed’s maximum-employment mandate?
404,JULIE CHABANAS,Are you worried about that—about this rebound?
405,CHAIR POWELL,"So we are, of course, worried about—there are—there are long-standing differences in racial and ethnic groups across, across our labor market."
406,CHAIR POWELL,That’s a factor that we don’t—we can’t really address with our tools.
407,CHAIR POWELL,"But we do consider that when we’re thinking about what constitutes maximum employment—it is, for us, a broad and inclusive goal."
408,CHAIR POWELL,And so we do watch that.
409,CHAIR POWELL,"But remember, all unemployment, including Black unemployment, has been bouncing around right near historic lows—historic modern lows here."
410,CHAIR POWELL,"So we’re still talking about, I mean, what is as strong a labor market as we’ve seen in, you know, a half-century here in the United States."
411,CHAIR POWELL,"So overall unemployment of 3.7 percent is, is higher—three-tenths higher than it was measured to be at the last—a month ago."
412,CHAIR POWELL,"But, still, it’s extraordinarily low."
413,CHAIR POWELL,"And so it’s a very, very tight labor market."
414,MICHELLE SMITH,Megan.
415,MEGAN CASSELLA,Thank you.
416,MEGAN CASSELLA,I want to follow up first a little bit just on the rent question on housing.
417,MEGAN CASSELLA,We heard Governor Waller talk about how—I’ll back up.
418,MEGAN CASSELLA,"We haven’t June 14, 2023 quite seen the slowdown in rents show up in CPI yet."
419,MEGAN CASSELLA,And we did hear Governor Waller talk Chair Powell’s Press Conference FINAL about how an uptick in housing might mean that there’s not going to be as much relief coming or a shorter bit of relief than we thought.
420,MEGAN CASSELLA,Can you talk about how you’re thinking about that and how that played into today’s outcome?
421,CHAIR POWELL,"I wouldn’t say—that’s, you know—as a factual matter, that’s correct."
422,CHAIR POWELL,"We do need to see, you know, rents bottom out here or at least stay quite low in terms of their increases because we want—we want the, you know, we want inflation to come down."
423,CHAIR POWELL,"And rental is, is a very large part of the CPI—about a third—and it’s about half of that for the PCE."
424,CHAIR POWELL,So it’s important.
425,CHAIR POWELL,And so we’re—it’s something that we’re watching very carefully.
426,CHAIR POWELL,It’s part of the overall picture.
427,CHAIR POWELL,"I wouldn’t say it’s the decisive part, but take a step back."
428,CHAIR POWELL,"What you see is—look at—look at core inflation over the past six months, a year."
429,CHAIR POWELL,You’re just not seeing a lot of progress—not the kind of progress we want to see.
430,CHAIR POWELL,"And that, that’s—it’s hard to avoid that."
431,CHAIR POWELL,"And, you know, the Committee—people on the Committee—the median went up significantly, so that the median participant now thinks that core PCE inflation on a 12-month basis will be 3.9 percent this year."
432,CHAIR POWELL,"So, once again, every year for the past three years, it’s gone up over the course of the year, and that’s doing that again."
