,speaker,sentence
0,CHAIR POWELL,Good afternoon.
1,CHAIR POWELL,My colleagues and I remain squarely focused on our dual mandate to promote maximum employment and stable prices for the American people.
2,CHAIR POWELL,"We understand the hardship that high inflation is causing, and we remain strongly committed to bringing inflation back down to our 2 percent goal."
3,CHAIR POWELL,Price stability is the responsibility of the Federal Reserve.
4,CHAIR POWELL,"Without price stability, the economy doesn’t work for anyone."
5,CHAIR POWELL,"In particular, without price stability, we will not achieve a sustained period of strong labor market conditions that benefit all."
6,CHAIR POWELL,"Since early last year, the FOMC has significantly tightened the stance of monetary policy."
7,CHAIR POWELL,"We have raised our policy interest rate by 5 percentage points, and we’ve continued to reduce our securities holdings at a brisk pace."
8,CHAIR POWELL,"We’ve covered a lot of ground, and the full effects of our tightening have yet to be felt."
9,CHAIR POWELL,"In light of how far we’ve come in tightening policy, the uncertain lags with which monetary policy affects the economy, and potential headwinds from credit tightening, today we decided to leave our policy interest rate unchanged and to continue to reduce our securities holdings."
10,CHAIR POWELL,"Looking ahead, nearly all Committee participants view it as likely that some further rate increases will be appropriate this year to bring inflation down to 2 percent over time."
11,CHAIR POWELL,And I will have more to say about monetary policy after briefly reviewing economic developments.
12,CHAIR POWELL,"The U.S. economy slowed significantly last year, and recent indicators suggest that economic activity has continued to expand at a modest pace."
13,CHAIR POWELL,"Although growth in consumer spending has picked up this year, activity in the housing sector remains weak, largely reflecting higher mortgage rates."
14,CHAIR POWELL,Higher interest rates and slower output growth also appear to be weighing on business fixed investment.
15,CHAIR POWELL,"Committee participants generally expect subdued June 14, 2023 growth to continue."
16,CHAIR POWELL,"In our Summary of Economic Projections, the median projection has real Chair Powell’s Press Conference FINAL GDP growth at 1.0 percent this year and 1.1 percent next year, well below the median estimate of the longer-run normal growth rate."
17,CHAIR POWELL,The labor market remains very tight.
18,CHAIR POWELL,"Over the past three months, payroll job gains averaged a robust 283,000 jobs per month."
19,CHAIR POWELL,The unemployment rate moved up but remained low in May at 3.7 percent.
20,CHAIR POWELL,There are some signs that supply and demand in the labor market are coming into better balance.
21,CHAIR POWELL,"The labor force participation rate has moved up in recent months, particularly for individuals aged 25 to 54 years."
22,CHAIR POWELL,"Nominal wage growth has shown signs of easing, and job vacancies have declined so far this year."
23,CHAIR POWELL,"While the jobs-to-workers gap has declined, labor demand still substantially exceeds the supply of available workers."
24,CHAIR POWELL,"FOMC participants expect supply and demand conditions in the labor market to come into better balance over time, easing upward pressures on inflation."
25,CHAIR POWELL,The median unemployment rate projection in the SEP rises to 4.1 percent at the end of this year and 4.5 percent at the end of next year.
26,CHAIR POWELL,Inflation remains well above our longer-run 2 percent goal.
27,CHAIR POWELL,"Over the 12 months ending in April, total PCE proces—prices rose 4.4 percent; excluding the volatile food and energy categories, core PCE prices rose 4.7 percent."
28,CHAIR POWELL,"In May, the 12-month change in the consumer price index came in at 4 percent, and the change in the core, core CPI was 5.3 percent."
29,CHAIR POWELL,Inflation has moderated somewhat since the middle of last year.
30,CHAIR POWELL,"Nonetheless, inflation pressures continue to run high, and the process of getting inflation back down to 2 percent has a long way to go."
31,CHAIR POWELL,"The median projection in the SEP for total PCE inflation is 3.2 percent this year, 2.5 percent next year, and 2.1 percent in 2025."
32,CHAIR POWELL,"Core PCE inflation, which excludes volatile food and energy prices, is projected to run higher than total inflation, and the median projection has been revised in the SEP up to 3.9 percent this year."
33,CHAIR POWELL,"Despite elevated inflation, longer-term inflation June 14, 2023 expectations appear to remain well anchored, as reflected in a broad range of surveys of Chair Powell’s Press Conference FINAL households, businesses, and forecasters, as well as measures from financial markets."
34,CHAIR POWELL,The Fed’s monetary policy actions are guided by our mandate to promote maximum employment and price—and stable prices for the American people.
35,CHAIR POWELL,"My colleagues and I are acutely aware that high inflation imposes hardship, as it erodes purchasing power, especially for those least able to meet the higher costs of essentials like food, housing, and transportation."
36,CHAIR POWELL,"We are highly attentive to the risks that high inflation poses to both sides of our mandate, and we’re strongly committed to returning inflation to our 2 percent objective."
37,CHAIR POWELL,"As I noted earlier, since early last year, we’ve raised our policy rate by 5 percentage points."
38,CHAIR POWELL,"We have been seeing the effects of our policy tightening on demand in the most interest rate–sensitive sectors of the economy, especially housing and investment."
39,CHAIR POWELL,"It will take time, however, for the full effects of monetary restraint to be realized, especially on inflation."
40,CHAIR POWELL,"The economy is facing headwinds from tighter credit conditions for households and businesses, which are likely to weigh on economic activity, hiring, and inflation."
41,CHAIR POWELL,The extent of these effects remains uncertain.
42,CHAIR POWELL,"In light of how far we’ve come in tightening policy, the uncertain lags with which monetary policy affects the economy, and potential headwinds from credit tightening, the Committee decided at today’s meeting to maintain the target range for the federal funds rate at 5 to 5¼ percent and to continue the process of significantly reducing our securities holdings."
43,CHAIR POWELL,"As I noted earlier, nearly, nearly all Committee participants expect that it will be appropriate to raise interest rates somewhat further by the end of the year."
44,CHAIR POWELL,"But at this meeting, considering how far and how fast we’ve moved, we judged it prudent to hold the target range steady to allow the Committee to assess additional information and its implications for monetary June 14, 2023 policy."
45,CHAIR POWELL,"In determining the extent of additional policy firming that may be appropriate to return Chair Powell’s Press Conference FINAL inflation to 2 percent over time, the Committee will take into account the cumulative tightening of monetary policy, the lags with which monetary policy affects economic activity and inflation, and economic and financial developments."
46,CHAIR POWELL,"In our SEP, participants wrote down their individual assessments of an appropriate path for the federal funds rate based on what each participant judges to be the most likely scenario going forward."
47,CHAIR POWELL,"If the economy evolves as projected, the median participant projects that the appropriate level of the federal funds rate will be 5.6 percent at the end of this year, 4.6 percent at the end of 2024, and 3.4 percent at the end of 2025."
48,CHAIR POWELL,"For the end of this year, the median projection is ½ percentage point higher than in our March projections."
49,CHAIR POWELL,"I hasten to add, as always, that these projections are not a Committee decision or plan."
50,CHAIR POWELL,"If the economy does not evolve as projected, the path for policy will adjust as appropriate to foster our maximum-employment and price-stability goals."
51,CHAIR POWELL,"We will continue to make our decisions meeting by meeting, based on the totality of incoming data and their implications for the outlook for economic activity and inflation, as well as the balance of risks."
52,CHAIR POWELL,We remain committed to bringing inflation—bringing inflation back down to our 2 percent goal and to keeping longer-term inflation expectations well anchored.
53,CHAIR POWELL,Reducing inflation is likely to require a period of below-trend growth and some softening of labor market conditions.
54,CHAIR POWELL,Restoring price stability is essential to set the stage for achieving maximum employment and stable prices over the longer run.
55,CHAIR POWELL,"To conclude: We understand that our actions affect communities, families, and businesses across the country."
56,CHAIR POWELL,Everything we do at the Fed is in service to our public mission.
57,CHAIR POWELL,"June 14, 2023 We will do everything we can to achieve our maximum-employment and price-stability goals."
58,CHAIR POWELL,Chair Powell’s Press Conference FINAL Thank you.
59,CHAIR POWELL,And I look forward to your questions.
60,MICHELLE SMITH,Colby.
61,COLBY SMITH,Thank you.
62,COLBY SMITH,Colby Smith with the Financial Times.
63,COLBY SMITH,I’m curious what gives you and the Committee the confidence that waiting will not be counterproductive at a time when the monthly pace of core inflation is still so elevated.
64,COLBY SMITH,"Interest rate–sensitive sectors like housing, while they’ve felt the drag of the past Fed actions, have started to recover in some regions, and financial conditions, you know, most recently were easing."
65,CHAIR POWELL,"So, I guess I would—I guess I would go back to the beginning of this tightening cycle to address that."
66,CHAIR POWELL,"So as we started our rate hikes early last year, we said there were three issues that would need to be addressed kind of in sequence—that of the speed of tightening, the level to which rates would need to go, and then a period of time over which we’d need to keep policy restrictive."
67,CHAIR POWELL,"So at the outset, going back 15 months, the key issue was how fast to move rates up, and we moved very quickly by historical standards."
68,CHAIR POWELL,"Then last December, after four consecutive 75 basis point hikes, we moderated to a pace of 50—of a 50 basis point hike and then this year to three 25 basis point hikes at sequential meetings."
69,CHAIR POWELL,So it seemed to us to make obvious sense to moderate our rate hikes as we got closer to our destination.
70,CHAIR POWELL,"So the decision to consider not hiking at every meeting and ultimately to hold rates steady at this meeting, I would just say it’s a continuation of, of that process."
71,CHAIR POWELL,"The main issue that we’re focused on now is determining the extent of additional policy firming that may be appropriate to return inflation to 2 percent over time—so that the pace of the increases and the ultimate level of increases are separate variables, given how far it—we have come."
72,CHAIR POWELL,It may make sense for rates to move higher but at a more moderate pace.
73,CHAIR POWELL,I want to stress one more thing—and that is that the Committee decision made today was only about this meeting.
74,CHAIR POWELL,"We didn’t make any decision about going forward, including what would happen at the next meeting, including—we did not decide or really discuss anything about going to an every-other-meeting kind of an approach or, or really any other approach."
75,CHAIR POWELL,We really were focused on what to do at this meeting.
76,COLBY SMITH,So there was no kind of initial debate about the possibility of July—any sense of the initial support at this stage for that move?
77,CHAIR POWELL,"So again, we didn’t—we didn’t make a decision about July."
78,CHAIR POWELL,"I mean, of course, it, it came up in the—in the meeting from time to time."
79,CHAIR POWELL,"But really, the focus was, was on what to do today."
80,CHAIR POWELL,"I would say about, about July two things: (1) [the] decision hasn’t been made, (2) I do expect that it will be a “live” meeting."
81,MICHELLE SMITH,Howard.
82,HOWARD SCHNEIDER,Thanks.
83,HOWARD SCHNEIDER,Howard Schneider with Reuters.
84,HOWARD SCHNEIDER,"I was just wondering if you could help us understand the, the narrative here because it feels like there’s been a level shift in the—in the dots, stronger GDP, less of a hit to unemployment, slower progress on inflation."
85,HOWARD SCHNEIDER,"And I’m wondering in, in this sort of—where’s the disinflation coming from?"
86,CHAIR POWELL,Sure.
87,HOWARD SCHNEIDER,The labor market’s going to be stronger it looks like—it’s not coming from there.
88,HOWARD SCHNEIDER,Demand’s not coming down all that fast.
89,HOWARD SCHNEIDER,"According to GDP—you’ve doubled your, your estimate of GDP."
90,HOWARD SCHNEIDER,So what’s the—what’s the narrative here?
91,HOWARD SCHNEIDER,"It seems like it’s getting more “immaculate,” rather than more messy."
92,CHAIR POWELL,"So you’re, you’re right that the data came in, I would say, consistent with, but on the high side of, expectations."
93,CHAIR POWELL,"And if you go back to the old—the former SEP—the last SEP in March, you will see that [compared with March, projected real GDP] growth moved up."
94,CHAIR POWELL,"These are not huge moves, but growth estimates moved up a bit."
95,CHAIR POWELL,Unemployment estimates moved down a bit.
96,CHAIR POWELL,Inflation estimates moved up a bit.
97,CHAIR POWELL,"And, you know, all three of those kind of point in the same direction—which is, you know, that perhaps more [monetary policy] restraint will be necessary than we had thought at the last meeting."
98,CHAIR POWELL,"So although the level, frankly, is, is pretty—the level of 5.6 [percent] is pretty consistent, if you think about it, where the [expected] federal funds rate was trading before the bank incidents of early March."
99,CHAIR POWELL,So—but so we’ve kind of gone back to that.
100,CHAIR POWELL,"So your question is, where’s the—where’s the disinflation going to come from?"
101,CHAIR POWELL,"And I, you know, I don’t think the story has really changed."
102,CHAIR POWELL,We—the Committee has consistently said and believed that the process of getting inflation down is going to be a gradual one.
103,CHAIR POWELL,It’s going to take some time.
104,CHAIR POWELL,"And I think you go back to the—to the three-part framework for [analyzing] core PCE inflation—which is, we think, as good an indicator as you can have for where inflation is going forward."
105,CHAIR POWELL,You start with goods.
106,CHAIR POWELL,"With goods, we need to see continued healing in supply conditions—supply-side conditions."
107,CHAIR POWELL,"They’ve definitely improved a substantial amount, but if you talk to people in business, they will say it’s not back to where it was."
108,CHAIR POWELL,"So that’s, that’s one thing."
109,CHAIR POWELL,"And that should enable goods prices to continue—goods, goods inflation to continue to come down over time."
110,CHAIR POWELL,In terms of housing services inflation—that’s another big piece.
111,CHAIR POWELL,"And, and you are seeing there that new rents in new, new leases are, are coming in at low levels."
112,CHAIR POWELL,And it’s really a matter of time as that goes through the pipeline.
113,CHAIR POWELL,"In fact, I think any forecast that people are making right now about inflation coming down this year will, will contain a big dose of—this year and June 14, 2023 next year—will contain a, a good amount of, of disinflation [coming] from that source."
114,CHAIR POWELL,"And, and Chair Powell’s Press Conference FINAL that’s, again, probably going to come slower than we would [previously have expected it to come into] effect."
115,CHAIR POWELL,"That leaves, you know, the big sector, which is a little more than half, pardon me, of the—of core PCE inflation that’s not housing services."
116,CHAIR POWELL,"And, you know, we see only the earliest signs of disinflation there."
117,CHAIR POWELL,It’s a sector—it’s a very broad and diverse sector.
118,CHAIR POWELL,"I would say [that,] in a number of the parts of that sector, the largest cost would be wage cost."
119,CHAIR POWELL,"It’s the service sector, so it’s, it’s heavily labor intensive."
120,CHAIR POWELL,And I think many analysts would say that the key to getting inflation down there is to have a continuing loosening in labor market conditions—which we have seen.
121,CHAIR POWELL,"We have actually seen, you know—I go through a number of indicators suggesting there has been some loosening in labor market conditions."
122,CHAIR POWELL,We need to see that continue.
123,CHAIR POWELL,"I would almost say that the, the conditions that we need to see in place to get inflation down are, are coming into place."
124,CHAIR POWELL,And that would be [real GDP] growth meaningfully below trend.
125,CHAIR POWELL,It would be a labor market that’s loosening.
126,CHAIR POWELL,It would be goods pipelines getting healthier and healthier and that kind of thing.
127,CHAIR POWELL,"There, there—the things are in place that we need to see, but the process of that actually working on inflation is going to take some time."
128,MICHELLE SMITH,Nick.
129,NICK TIMIRAOS,Nick Timiraos of the Wall Street Journal.
130,NICK TIMIRAOS,"Chair Powell, what’s the value in, in pausing and signaling future hikes versus just hiking now?"
131,NICK TIMIRAOS,"I mean, not to be flippant, but I don’t lose weight just by buying a gym membership—I have to actually go to the gym."
132,NICK TIMIRAOS,Sixteen of your colleagues put down a higher year-end ’23 rate today.
133,NICK TIMIRAOS,"A majority of you June 14, 2023 think you’re going to have to go up by 50 basis points this year."
134,NICK TIMIRAOS,So why not just rip off the Chair Powell’s Press Conference FINAL Band-Aid and raise rates today?
135,CHAIR POWELL,"So the—first, I would say that the, the question of speed is a separate question from the question—from the—from, from that of level."
136,CHAIR POWELL,Okay.
137,CHAIR POWELL,"So—and I think if you look at the SEP, that is our estimate—our individual—it’s, it’s really a cumulation of our individual estimates of how far to go."
138,CHAIR POWELL,"I, I mentioned how, how we got to those numbers."
139,CHAIR POWELL,"In terms of speed, it’s, it’s what I said at the beginning, which is, speed was very important last year."
140,CHAIR POWELL,"As we get closer and closer to the destination—and, according to the SEP, we’re not so far away from the destination, in most people’s accounting—it’s, it’s reasonable—it’s common sense to go a little slower, just as it was reasonable to go from 75 basis points to 50 to 25 at every meeting."
141,CHAIR POWELL,"And so the Committee thought overall that it was appropriate to moderate the pace, if only slightly."
142,CHAIR POWELL,Then there are benefits to that.
143,CHAIR POWELL,So that gives us more information to make decisions.
144,CHAIR POWELL,We may try to make better decisions.
145,CHAIR POWELL,"I think it allows the economy a little more time to adapt as we—as we make our decisions going forward, and we’ll get to see, you know—we haven’t really—we don’t know the full extent of, of the consequences of the banking turmoil that we’ve seen."
146,CHAIR POWELL,"We, we—it would be early to see those, but we don’t know what the extent is."
147,CHAIR POWELL,We’ll have some more time to see that unfold.
148,CHAIR POWELL,"I mean, it’s, it’s just the idea that we’re trying to get this right."
149,CHAIR POWELL,"And this is—if you think of the two things as separate variables, then I think—I think that the skip—I shouldn’t call it a skip—the, the decision makes sense."
150,NICK TIMIRAOS,I know you said July is live.
151,NICK TIMIRAOS,"With only one June employment—with only the June employment and the CPI report for June due to be released before the July meeting—you get the ECI after, you get the Senior Loan Officer Survey after, you get some June 14, 2023 bank earnings at the end of next month—what incremental information will the Committee be Chair Powell’s Press Conference FINAL using to inform their judgment on whether this is, in fact, a skip or a, a longer pause?"
152,CHAIR POWELL,"Well, I think you’re adding that to the, the data that we’ve seen since the last meeting, too."
153,CHAIR POWELL,"You know, we—since we chose to maintain rates at this meeting, it’ll really be a three-month period of data that we can look at."
154,CHAIR POWELL,"And I think that’s a full quarter, and I think you can—you can draw more conclusions from that than you can from any six—any six-week period."
155,CHAIR POWELL,We’ll look at those things.
156,CHAIR POWELL,We’ll also look at the evolving risk picture.
157,CHAIR POWELL,We’ll look at what’s happening in the financial sector.
158,CHAIR POWELL,"We’ll look at all the data, the evolving outlook, and we’ll make a decision."
159,MICHELLE SMITH,Jeanna.
160,JEANNA SMIALEK,Thanks for taking our questions.
161,JEANNA SMIALEK,"Jeanna Smialek, New York Times."
162,JEANNA SMIALEK,"You obviously, in your forecasts, marked up the sort of path for growth, marked down the path for unemployment, and marked up the path for inflation pretty notably."
163,JEANNA SMIALEK,"I wonder, you know, since March, what has changed to make you think that the economy’s a lot more resilient and inflation is going to be a lot more stubborn?"
164,JEANNA SMIALEK,"And given that, you know, why do you feel confident that this is as high as you’re going to have to revise the federal funds rate?"
165,JEANNA SMIALEK,"Or do you think it’s possible we could have even a higher than 5.6 percent terminal by the end of this, this cycle?"
166,CHAIR POWELL,"You know, I—I mean, on the first part, I just think we’re following the data and also the outlook."
167,CHAIR POWELL,"The economy is—the labor market, I think, has surprised many, if not all, analysts over the last couple of years with its extraordinary resilience, really."
168,CHAIR POWELL,"And it’s, it’s just remarkable."
169,CHAIR POWELL,"And that’s really, if you think about it—that’s what’s driving it."
170,CHAIR POWELL,"It’s job June 14, 2023 creation."
171,CHAIR POWELL,"It’s, it’s wages moving up."
172,CHAIR POWELL,"It’s, it’s supporting spending, which in turn is supporting Chair Powell’s Press Conference FINAL hiring."
173,CHAIR POWELL,"And it’s, it’s really the engine, it seems, that is—that is driving the economy."
174,CHAIR POWELL,"And so it’s, it’s really the, the data."
175,CHAIR POWELL,"In terms of, you know—we, we always write down at these meetings what we think the appropriate terminal rate will be at the end of this year."
176,CHAIR POWELL,"That’s, that’s how we do it."
177,CHAIR POWELL,"It’s based on our, our own individual assessments of what the most likely path of the economy is."
178,CHAIR POWELL,"It can be—it can actually, in reality, wind up being lower or higher."
179,CHAIR POWELL,"And, you know, there’s really no way to know."
180,CHAIR POWELL,"But it’s—it is—it’s, it’s what people think as of today, and as the—as the data come in, it, it can move around during the intermeeting period."
181,CHAIR POWELL,It could wind up back in the same place.
182,CHAIR POWELL,But it really will be data driven.
183,CHAIR POWELL,I can’t—I can’t tell you that that I ever have a lot of confidence that we can see where the—where the federal funds rate will be that far in advance.
184,MICHELLE SMITH,Steve.
185,STEVE LIESMAN,"Mr. Chairman, thanks for taking my question."
186,STEVE LIESMAN,You had said back at the end of May that you thought risks were getting closer to being into balance.
187,STEVE LIESMAN,"Is that still the case, or has your mind changed about the balance of risks out there?"
188,STEVE LIESMAN,"And also, could you give us an idea of what would be a sufficiently restrictive funds rate?"
189,STEVE LIESMAN,"Is the—obviously, the current rate, according to the Committee, is not sufficiently restrictive."
190,STEVE LIESMAN,Is it 5.6?
191,STEVE LIESMAN,Is it 6?
192,STEVE LIESMAN,Where is sufficiently restrictive?
193,STEVE LIESMAN,Thank you.
194,CHAIR POWELL,"You know, I, I would say again that I think that, over time, the balance of risks, as we move from very, you know—from interest rates that are effectively zero now to 5 percentage points with, with an SEP calling for additional hikes—I think we’ve moved much closer to our destination, which is that sufficiently restrictive rate, and I think that means by—almost by definition that the—that the risks of, of sort of overdoing it and under, June 14, 2023 underdoing it are, are getting closer to being in balance."
195,CHAIR POWELL,"I still think, and my, my colleagues Chair Powell’s Press Conference FINAL agree, that, that the risks to inflation are to the upside still."
196,CHAIR POWELL,So we don’t—we don’t think we’re there with inflation yet because we’re just looking at the data.
197,CHAIR POWELL,"And if you look at the—at the full range of, of inflation data, particularly the core data, you just—you just aren’t seeing a lot of progress over the last year."
198,CHAIR POWELL,"Headline, of course, inflation has come down materially, but, as you know, we look at core [inflation] as a better indicator of where inflation overall is going."
