,speaker,sentence
433,CHAIR POWELL,"So we see that, and we see that inflation forecasts are coming in low again, and we see that—that that tells us that we need to do more."
434,CHAIR POWELL,And so we’re—that’s why you see the SEP with—where it is.
435,MEGAN CASSELLA,"Could you also talk briefly about your outlook for wages and, given the recent slowdown in core services excluding housing, how far you think wages might need to fall in order to get inflation back in line?"
436,CHAIR POWELL,So wages will continue to increase.
437,CHAIR POWELL,"So we, we, you know—what we’re talking about is having wage increases still at a very strong level but at a level that’s June 14, 2023 consistent with 2 percent inflation over time."
438,CHAIR POWELL,"And so I, I think we’ve seen some progress—all, Chair Powell’s Press Conference FINAL all of the major measures of wages have, have moved down from extremely elevated—not extremely elevated—highly elevated levels a year or so ago, and they’re, they’re moving back down but, but quite gradually."
439,CHAIR POWELL,"And, and, you know, we want to see that, that process continue gradually."
440,CHAIR POWELL,"Of course, it’s great to see wage increases, particularly for people at the lower end of the income spectrum."
441,CHAIR POWELL,"But we want that as part of the process of getting inflation back down to 2 percent, which benefits everyone."
442,CHAIR POWELL,"I mean, inflation hurts those same people more than anyone else."
443,CHAIR POWELL,"People on a fixed income are hurt the worst, and the fastest, by high inflation."
444,MICHELLE SMITH,Greg.
445,GREG ROBB,"Thank you so much, Chair Powell."
446,GREG ROBB,Greg Robb from MarketWatch.
447,GREG ROBB,"I just wondered if the Committee has talked at all about the labor market and, and—there, there’s strikes now in Hollywood and now the United Autoworkers are talking about a possible strike."
448,GREG ROBB,"I mean, aren’t workers—they have—we have some—workers have power now and are going to be seeking higher wages."
449,GREG ROBB,Does that come up in your discussions?
450,GREG ROBB,Thanks.
451,CHAIR POWELL,"So the topic of wages in the labor market and dynamics in the labor market could—is about as central a topic to our discussions as, as anything."
452,CHAIR POWELL,"I mean, it’s, it’s very—labor economics, you know, and the labor market are utterly central."
453,CHAIR POWELL,"You know, it’s half of our mandate."
454,CHAIR POWELL,So we spend a lot of time talking about that.
455,CHAIR POWELL,"I think, you know, we—there, there are structural issues that are really not for the Fed."
456,CHAIR POWELL,"And so we don’t spend a lot of time— although we take notice of, of what’s going on, but we’re not, you know—we’re not involved in discussions or debates over, over strikes and things like that."
457,CHAIR POWELL,"But we—you know, we, we look, and we see what’s going on."
458,CHAIR POWELL,"And, you know, we’re making judgments about what it will take to get inflation down to 2 percent in the aggregate."
459,CHAIR POWELL,"And as I said, don’t think that was about—I June 14, 2023 didn’t—most folks would say now it wasn’t really about that—about wages at the beginning."
460,CHAIR POWELL,"Chair Powell’s Press Conference FINAL And it’s becoming more about that as we—as we get into really service-sector inflation, which is the part of the economy where we have seen the least progress."
461,MICHELLE SMITH,Let’s go to Mark for the last question.
462,MARK HAMRICK,"Thank you, Mr. Chairman."
463,MARK HAMRICK,Mark Hamrick with Bankrate.
464,MARK HAMRICK,Wondering what your thoughts are now about systemic risk now that we’re about three months past the failure of Silicon Valley Bank.
465,MARK HAMRICK,"And also, specifically, what are the risks associated with commercial real estate as well as nonbank financials?"
466,MARK HAMRICK,"And could you further elevate those risks with higher still rates, possibly for longer?"
467,CHAIR POWELL,So I’m trying to think where to start.
468,CHAIR POWELL,I’ll start with commercial real estate.
469,CHAIR POWELL,"We—of course, we’re watching that situation very carefully."
470,CHAIR POWELL,There’s a substantial amount of commercial real estate in the banking system.
471,CHAIR POWELL,"A, a large part of it is in smaller banks."
472,CHAIR POWELL,"It’s well distributed—to the extent it’s well distributedthen, then the system could, could take losses."
473,CHAIR POWELL,"We do expect that there will be losses, but they’ll be—they’ll be banks that have concentrations, and those banks will experience larger losses."
474,CHAIR POWELL,So we’re well aware of that.
475,CHAIR POWELL,We’re monitoring it carefully.
476,CHAIR POWELL,"You know, it feels like—it feels like something that will be around for some time, as opposed to, you know, something that will suddenly hit and, and, you know, work its way into systemic risk."
477,CHAIR POWELL,In terms of nonbank financials—financial sector—there’s been a ton of work.
478,CHAIR POWELL,"And, you know, clearly in the—in the pandemic, it really was—it was the nonbank financial sector where, where issues really arose."
479,CHAIR POWELL,"And, you know, there’s a lot of work going on in—with the Administration, in particular, leading that to try to address issues in the Treasury market and, and in all kinds of areas in the nonbank financial market."
480,CHAIR POWELL,"And—but, you know, our jurisdiction at June 14, 2023 the Fed is over banks—actually bank holding companies and some banks."
481,CHAIR POWELL,"So that’s, that’s really Chair Powell’s Press Conference FINAL our main focus."
482,CHAIR POWELL,"You know, in terms of the events of March—as I mentioned earlier, we will be carefully monitoring that situation."
483,CHAIR POWELL,"You know, our, our job generally involves worrying about a lot of things that may go wrong, and that would include the banks."
484,CHAIR POWELL,It might be hard for me to identify something that we don’t worry about rather than that we do worry about.
485,CHAIR POWELL,So we’re watching those things very carefully.
486,CHAIR POWELL,"And as we see things unfold—as we see what’s happening with credit conditions and, and also all the individual banks that are out there, you know, we’ll be able to take, to the extent it’s appropriate, we can take, if they’re macroeconomic implications, we can take that into account in our rate setting."
487,CHAIR POWELL,And so I guess that’s what I would say.
488,MARK HAMRICK,Can I just follow up on the last part of that?
489,MARK HAMRICK,Do you—do you risk further exacerbating those issues if you get up to another 50 basis points?
490,CHAIR POWELL,"So that’s—and, and I was—I guess I meant to address that by saying as we—as we watch, we’ll see what’s happening."
491,CHAIR POWELL,"And if we—if we’re seeing the kind of tightening of conditions that, that you could be referring to, then we can factor that—because really, we’re—we use our—our rate tool is, is, you know, is—it really has macroeconomic purposes."
492,CHAIR POWELL,"So we’ll, we’ll take that into account."
493,CHAIR POWELL,"Of course, we have responsibility for financial stability as well."
494,CHAIR POWELL,And that also is a factor that we’re always going to be considering.
495,CHAIR POWELL,Thank you very much.
