,speaker,sentence
277,CHAIR POWELL,Everyone— particularly people on fixed incomes and at the lower part of the income distribution are better off with stable prices.
278,CHAIR POWELL,And so we need to do everything we can to restore stable prices.
279,CHAIR POWELL,We’ll do it as quickly and effectively as we can.
280,CHAIR POWELL,"We think we have a good chance to do it without a significant increase in unemployment or, you know, a really sharp slowdown."
281,CHAIR POWELL,"But, ultimately, we think about the medium and longer term, and everyone will be better off if we can get this job done—the sooner, the better."
288,CHAIR POWELL,So the economy is doing fairly well.
289,CHAIR POWELL,We expect growth to be solid this year.
290,CHAIR POWELL,"And we see, you know, household spending and business investment as fairly strong—and even in the first quarter, which was relatively slow on some other fronts."
291,CHAIR POWELL,"So, and the labor market—if you look at the labor market, for people who are out of work and looking, there are lots of job opportunities for—wages are moving up and at rates that haven’t been seen in quite a long time."
292,CHAIR POWELL,"So it’s a good time to be a worker looking to, you know, either change jobs or get a wage increase in your current job."
293,CHAIR POWELL,"So it’s a strong economy, and nothing about it suggests that it’s close to, or vulnerable to, a recession."
294,CHAIR POWELL,"Now, of course, given events around the world and fading fiscal policy effects and higher rates, you could see some slower economic activity."
295,CHAIR POWELL,"Certainly, it will not be—last year was an extraordinarily strong growth year as we recovered from the pandemic."
296,CHAIR POWELL,"As I mentioned, growth [was] over 5 percent."
297,CHAIR POWELL,"But most forecasters have growth this year at, you know, at a solid pace above 2 percent."
299,CHAIR POWELL,"So, and as I said, I think we have a good chance to restore price stability without a recession—without, you know, a severe downturn; without materially high, higher unemployment."
300,CHAIR POWELL,And I mentioned the reasons for that.
301,CHAIR POWELL,So I see a strong economy now.
302,CHAIR POWELL,"I see a very strong labor market, for example."
303,CHAIR POWELL,"Businesses can’t find the people to hire—they can’t May 4, 2022 find them."
304,CHAIR POWELL,"So, typically, in a recession, you would have unemployment."
305,CHAIR POWELL,Now you have surplus Chair Powell’s Press Conference FINAL demand.
306,CHAIR POWELL,"So there should be room, in principle, to reduce that surplus demand without putting people out of work."
307,CHAIR POWELL,The issue will come that we don’t have precision surgical tools.
308,CHAIR POWELL,"We have, essentially, interest rates, the balance sheet, and forward guidance, and they’re famously blunt tools."
309,CHAIR POWELL,They’re not capable of surgical precision.
310,CHAIR POWELL,So I would agree.
311,CHAIR POWELL,"No one thinks this will be easy, no one thinks it’s straightforward, but there is certainly a plausible path to this, and I do think we’ve got a good chance to do that."
312,CHAIR POWELL,"And, you know, our job is not to rate the chances—it is to try to achieve it."
313,CHAIR POWELL,So that’s what we’re doing.
314,CHAIR POWELL,"There are a range of opinions, though, and that’s only appropriate."
320,CHAIR POWELL,"You know, it’s really the Fed that has responsibility for price stability."
321,CHAIR POWELL,"And we take whatever arrives at the Fed in terms of fiscal activity, we take it as a given, and we don’t evaluate it—it’s not our job, really."
322,CHAIR POWELL,We don’t have an oversight function there.
323,CHAIR POWELL,"And we look at it as our job, given all the factors that are happening, to try to sustain maximum employment and price stability."
324,CHAIR POWELL,"So if Congress or the Administration has ways to help with inflation, I would encourage that, but I’m not going to get into making recommendations or anything like that."
325,CHAIR POWELL,"It’s not, it’s really not our role—we need to stay in our lane and do our job."
326,CHAIR POWELL,"When we get inflation back under control, then maybe I can, you know, give other people advice [laughter]."
327,CHAIR POWELL,"Right now, we need to focus on, just focus on doing our job."
328,CHAIR POWELL,And I’ll stick to that.
329,CHAIR POWELL,Stick in our lane.
336,CHAIR POWELL,So I think it’s certainly possible that we’ll need to move policy to levels that we see as restrictive as opposed to just neutral.
337,CHAIR POWELL,We can’t know that today.
338,CHAIR POWELL,That decision is not in front of us today.
339,CHAIR POWELL,"If we do conclude that we need to do that, then we won’t hesitate to do it."
340,CHAIR POWELL,"I’ll say again, there’s no bright line, you know, that you’re stepping over."
341,CHAIR POWELL,You’re really looking at what our policy stance is and what the market is forecasting for it.
342,CHAIR POWELL,You’re looking at financial conditions and how that’s affecting the economy and making a judgment.
343,CHAIR POWELL,"You know, we won’t be arguing about whose model of the neutral rate is better than the other one."
344,CHAIR POWELL,It’s much more about a practical application of our policy tools.
345,CHAIR POWELL,And we’re absolutely prepared to do that.
346,CHAIR POWELL,It—wouldn’t hesitate if that’s what it takes.
348,CHAIR POWELL,I shouldn’t be singled out in this respect.
349,CHAIR POWELL,But I knew him just a little bit and have tremendous admiration for him.
350,CHAIR POWELL,And I—But I would phrase it this way: He had the courage to do what he thought was the right thing.
351,CHAIR POWELL,That’s what it was.
352,CHAIR POWELL,It wasn’t a particular thing.
353,CHAIR POWELL,It was that he always did—he always did—what he thought was the right thing.
354,CHAIR POWELL,"If you read his last autobiography, that really comes through."
355,CHAIR POWELL,So that’s [what] the test is.
357,CHAIR POWELL,"I would say, we do see, though—we see restoring price stability as absolutely essential for the country in coming years."
358,CHAIR POWELL,"Without price stability, the economy doesn’t work for anybody, really."
359,CHAIR POWELL,"And so it’s really essential, particularly for the labor market."
360,CHAIR POWELL,"If you think about it, like if you look at the last cycle, we had a very, very—longest expansion cycle in our recorded history."
361,CHAIR POWELL,"In the last two, three years, you had the benefits of this tight labor market going to people in the lower quartiles."
362,CHAIR POWELL,"And it was, you know, racial, wealth, and income—not wealth, but income gaps were coming down, wage gaps."
363,CHAIR POWELL,So it’s a really great thing.
364,CHAIR POWELL,We’d all love to get back to that place.
365,CHAIR POWELL,"But to get back to anything like that place, you need price stability."
366,CHAIR POWELL,"So, basically, we’ve been hit by historically large inflationary shocks since the pandemic."
367,CHAIR POWELL,This isn’t anything like regular business.
368,CHAIR POWELL,"This is, we have a pandemic, we have the highest unemployment, you know, in—since the Depression."
369,CHAIR POWELL,Then we have this outsized response from fiscal policy and monetary policy.
370,CHAIR POWELL,Then we have inflation.
371,CHAIR POWELL,"Then we have a war in Ukraine, which is cutting the commodity, you know, patch in half."
372,CHAIR POWELL,And now we have these shutdowns in China.
373,CHAIR POWELL,So it’s been a series of inflationary shocks that are really different from anything people have seen in 40 years.
374,CHAIR POWELL,So we have to look through that and look at the economy that’s coming out the other side.
375,CHAIR POWELL,And we need to somehow find price stability out of this.
376,CHAIR POWELL,"And it’s obviously going to be very challenging, I think, because you do have, you know, numerous supply shocks, which are famously difficult to deal with."
377,CHAIR POWELL,So I guess that’s how I think about it.
386,CHAIR POWELL,"So I didn’t—if I said “necessary,” I meant to say “appropriate.” We’re not going to be erecting a high barrier for this."
387,CHAIR POWELL,"It’s more, if we think it’s appropriate."
388,CHAIR POWELL,"You know, the point is, we’re a very long way from neutral now."
389,CHAIR POWELL,"We’re moving there expeditiously, and we’ll continue to do so."
390,CHAIR POWELL,"And we can’t make that decision, really, today."
391,CHAIR POWELL,The decision for about how high to go will be on the table to be made when we reach neutral.
392,CHAIR POWELL,"And, you know, I expect we’ll get there expeditiously, as I’ve mentioned."
393,CHAIR POWELL,So it’s not that we don’t want to—making that decision today wouldn’t really mean anything.
394,CHAIR POWELL,"But I’ll say again, if we do believe that it’s appropriate to go to those levels, we won’t hesitate."
402,CHAIR POWELL,"It was just, pick a date, you know, and that happened to be the date that we picked."
403,CHAIR POWELL,It was—nothing magic about it.
404,CHAIR POWELL,"You know, it’s not going to have any macroeconomic significance over time."
405,CHAIR POWELL,We just picked that.
406,CHAIR POWELL,"Sometimes we publish these calendars on the first day of the month, and that’s what we’re doing."
407,CHAIR POWELL,I wouldn’t read anything into it.
408,CHAIR POWELL,"In terms of the effect, I mean, I would just stress how uncertain the effect May 4, 2022 is of shrinking the balance sheet."
410,CHAIR POWELL,"And, you know, these are very uncertain."
411,CHAIR POWELL,I really can’t be any clearer.
412,CHAIR POWELL,There won’t be any clearer [estimates].
413,CHAIR POWELL,"You know, people estimate that, broadly, on the path we’re on—and this will be taken, probably, too seriously—but sort of ¼ percent, one rate increase over the course of a year at this pace."
414,CHAIR POWELL,"But I would just say, with very wide uncertainty bands—very wide."
415,CHAIR POWELL,We don’t really know.
416,CHAIR POWELL,"There are other estimates that are much smaller than that, by the way."
417,CHAIR POWELL,And some of you may read about that.
418,CHAIR POWELL,That’s kind of a mainstream estimate.
419,CHAIR POWELL,"We know that it is part of returning to more normal, more neutral financial conditions."
420,CHAIR POWELL,"And, you know, our strategy is to set up a plan and have it operate and really have, you know, have the interest rate be the active tool of monetary policy."
421,CHAIR POWELL,"In terms of speaking to the American people, so I feel like sometimes I just want to remind us, really, that that’s who we work for, and that it’s inflation that people are feeling all over the country."
422,CHAIR POWELL,And it’s very important that they know that we know how painful it is and that we are working hard on fixing it.
423,CHAIR POWELL,I thought it was quite important to do that.
424,CHAIR POWELL,And so that was really the thinking behind that.
426,CHAIR POWELL,"No, I don’t."
427,CHAIR POWELL,"And a good example of why would be—in the fourth quarter of last year, as we started talking about tapering sooner and then raising rates this year, you saw financial markets reacting, you know, very appropriately."
428,CHAIR POWELL,"Not to bless any particular day’s measure, but the way financial markets, the forward rate curve has tightened in response to our guidance and our actions really amplifies our policy."
429,CHAIR POWELL,"It’s—monetary policy is working through expectations now, to a very large extent."
430,CHAIR POWELL,We’ve only done two rate increases.
431,CHAIR POWELL,"But if May 4, 2022 you look at financial conditions, the two-year [rate] is at 280 [basis points] now."
432,CHAIR POWELL,"In September, I Chair Powell’s Press Conference FINAL think it was at 20 basis points."
433,CHAIR POWELL,And that’s all through the economy.
434,CHAIR POWELL,People are feeling those higher rates already.
435,CHAIR POWELL,And so that shows that the markets think that our forward guidance is credible.
436,CHAIR POWELL,And I think we want to keep it that way.
448,CHAIR POWELL,"Well, so, as I mentioned, you can see places where the demand is substantially in excess of supply."
449,CHAIR POWELL,"And what you’re seeing as a result of that is prices going up and at unsustainable levels, levels that are not consistent with 2 percent inflation."
450,CHAIR POWELL,"And so what our tools do is that as we raise interest rates, demand moderates: it moves down."
451,CHAIR POWELL,"Interest rates, you know—businesses will invest a little bit less, consumers will spend a little bit less."
452,CHAIR POWELL,That’s how it works.
453,CHAIR POWELL,"But, ultimately, getting those, getting supply and demand back, you know, back in balance, is what gives us 2 percent inflation, which is what gives the economy a footing where people can lead successful economic lives and not worry about inflation."
454,CHAIR POWELL,"I mean, so, yes, there may be some pain associated with getting back to that."
455,CHAIR POWELL,"But, you know, the big pain over time is in not dealing with inflation and allowing it to become entrenched."
464,CHAIR POWELL,"So, look, I think what you’ve seen is—really, I would say, in the middle of last fall—there was a time when our policy stance was still pretty much in sync with what the data were saying."
465,CHAIR POWELL,"If you remember, there were a couple of weak jobs reports."
466,CHAIR POWELL,"And inflation—month by month, inflation had come down till September, a few months in a row, stayed low."
467,CHAIR POWELL,"And then around the end of October, we got three or four really strong readings that just said, no, this is a much stronger economy."
468,CHAIR POWELL,"And by the way—then, with the restatement of the jobs numbers, it looked like the job market was much more even and stronger in the second half of the year."
469,CHAIR POWELL,But that hadn’t happened yet.
470,CHAIR POWELL,"Anyway, we got an ECI reading—employment compensation, [employment cost] index reading—the Friday before the November meeting."
471,CHAIR POWELL,Then we got a really strong jobs report.
472,CHAIR POWELL,Then we got a really high CPI report.
473,CHAIR POWELL,And so I think it became clear to the Committee that we needed to adjust and adapt.
474,CHAIR POWELL,And we have.
475,CHAIR POWELL,"Ever since then, really ever since then, we’ve been adapting."
476,CHAIR POWELL,"We, you know—the Committee moved by the time of the December meeting to a median [in participants’ 2022 projections] of three rate increases, then to a median of seven increases at the March meeting."
477,CHAIR POWELL,And that process is going on.
478,CHAIR POWELL,And it’s clearly continuing.
479,CHAIR POWELL,"And that’s why I say—and I actually mentioned this at the March meeting—that no one should look at any single SEP as sort of a real resting place for 90 days, because we’re in a fast-evolving situation."
480,CHAIR POWELL,And that’s what’s happened.
481,CHAIR POWELL,"You can see—unanimous vote today, of course."
482,CHAIR POWELL,"And I told you the guidance—that broad support on the May 4, 2022 Committee to have 50-basis-point hikes on the table at the next couple of meetings."
483,CHAIR POWELL,So you’re Chair Powell’s Press Conference FINAL right.
484,CHAIR POWELL,"And by the way, other forecasters have been doing the same thing."
485,CHAIR POWELL,And it’s just us adapting to the data and to the situation and using our tools to deal with it.
491,CHAIR POWELL,So unemployment rates for all racial groups have come down a lot and are now much closer to where they were before the pandemic hit.
492,CHAIR POWELL,So that’s one thing I would say.
493,CHAIR POWELL,And that’s important.
494,CHAIR POWELL,"But the bigger point is this: I do not, at this time, see the two sides of the mandate as in tension."
495,CHAIR POWELL,"I don’t, because you can see that the labor market is out of balance."
496,CHAIR POWELL,You can see that there’s a labor shortage.
497,CHAIR POWELL,There aren’t enough people to fill these job openings.
498,CHAIR POWELL,"And companies can’t hire, and wages are moving up at levels that would not, over time, be consistent with 2 percent inflation over time."
499,CHAIR POWELL,"And, of course, everyone loves to see wages go up."
500,CHAIR POWELL,"And it’s a great thing, but you want them to go up at a sustainable level, because these wages are, to some extent, being eaten up by inflation."
501,CHAIR POWELL,"So, what that really means is, to get the kind of labor market we really want to get, we really want to have a labor market that serves all Americans, especially the people in the lower-income part of the distribution, especially them."
502,CHAIR POWELL,"To do that, you’ve got to have price stability."
503,CHAIR POWELL,"And we’ve got to get back to price stability so that we can have a labor market where people’s wages aren’t being eaten up by inflation and where we can have a long expansion, too."
504,CHAIR POWELL,"That’s—the good things you can have, as we have."
505,CHAIR POWELL,"We’ve had—several of the longest expansions in U.S. history have been in the last 40 years, and that’s May 4, 2022 because it’s been a time of low inflation."
506,CHAIR POWELL,And long expansions are good for people and good for Chair Powell’s Press Conference FINAL the labor market.
507,CHAIR POWELL,So that’s the way I think about it.
508,CHAIR POWELL,"I think we—you know, our tools work."
509,CHAIR POWELL,"We have to think in the, in the medium and longer term."
510,CHAIR POWELL,"And I do think that the best thing for everyone is for us to get back to price stability to support, really, a sustained period of strong labor market conditions."
511,CHAIR POWELL,Thanks very much.
