,speaker,sentence
0,CHAIR POWELL,Good afternoon.
1,CHAIR POWELL,It’s nice to see everyone in person for the first time in a couple years.
2,CHAIR POWELL,"Before I go into the details of today’s meeting, I’d like to take this opportunity to speak directly to the American people."
3,CHAIR POWELL,"Inflation is much too high, and we understand the hardship it is causing, and we’re moving expeditiously to bring it back down."
4,CHAIR POWELL,We have both the tools we need and the resolve that it will take to restore price stability on behalf of American families and businesses.
5,CHAIR POWELL,The economy and the country have been through a lot over the past two years and have proved resilient.
6,CHAIR POWELL,It is essential that we bring inflation down if we are to have a sustained period of strong labor market conditions that benefit all.
7,CHAIR POWELL,"From the standpoint of our Congressional mandate to promote maximum employment and price stability, the current picture is plain to see: The labor market is extremely tight, and inflation is much too high."
8,CHAIR POWELL,"Against this backdrop, today the FOMC raised its policy interest rate by ½ percentage point and anticipates that ongoing increases in the target rate for the federal funds rate will be appropriate."
9,CHAIR POWELL,"In addition, we are beginning the process of significantly reducing the size of our balance sheet."
10,CHAIR POWELL,I’ll have more to say about today’s monetary policy actions after briefly reviewing economic developments.
11,CHAIR POWELL,"After expanding at a robust 5½ percent pace last year, overall economic activity edged down in the first quarter."
12,CHAIR POWELL,"Underlying momentum remains strong, however, as the decline largely reflected swings in inventories and net exports—two volatile categories whose movements last quarter likely carry little signal for future growth."
13,CHAIR POWELL,"Indeed, household spending and business fixed investment continued to expand briskly."
14,CHAIR POWELL,The labor market has continued to strengthen and is extremely tight.
15,CHAIR POWELL,"Over the first three months of the year, employment rose by nearly 1.7 million jobs."
16,CHAIR POWELL,"In March, the unemployment rate hit a post-pandemic, and near-five-decade, low of 3.6 percent."
17,CHAIR POWELL,"Improvements in labor market conditions have been widespread, including for workers at the lower end of the wage distribution as well as for African Americans and Hispanics."
18,CHAIR POWELL,"Labor demand is very strong, and, while labor force participation has increased somewhat, labor supply remains subdued."
19,CHAIR POWELL,"Employers are having difficulties filling job openings, and wages are rising at the fastest pace in many years."
20,CHAIR POWELL,Inflation remains well above our longer-run goal of 2 percent.
21,CHAIR POWELL,"Over the 12 months ending in March, total PCE prices rose 6.6 percent; excluding the volatile food and energy categories, core PCE prices rose 5.2 percent."
22,CHAIR POWELL,"Aggregate demand is strong, and bottlenecks and supply constraints are limiting how quickly production can respond."
23,CHAIR POWELL,"Disruptions to supply have been larger, and longer lasting, than anticipated, and price pressures have spread to a broader range of goods and services."
24,CHAIR POWELL,The surge in prices of crude oil and other commodities that resulted from Russia’s invasion of Ukraine is creating additional upward pressure on inflation.
25,CHAIR POWELL,And COVID-related lockdowns in China are likely to further exacerbate supply chain disruptions as well.
26,CHAIR POWELL,"Russia’s invasion of Ukraine is causing tremendous loss and hardship, and our thoughts and sympathies are with the people of Ukraine."
27,CHAIR POWELL,"Our job is to consider the implications for the U.S. economy, which remain highly uncertain."
28,CHAIR POWELL,"In addition to the effects on inflation, the invasion and related events are likely to restrain economic activity abroad and further disrupt supply chains, creating spillovers to the U.S. economy through trade and other channels."
29,CHAIR POWELL,The Fed’s monetary policy actions are guided by our mandate to promote maximum employment and stable prices for the American people.
30,CHAIR POWELL,"My colleagues and I are acutely aware that high inflation imposes significant hardship, especially on those least able to meet the higher costs of essentials like food, housing, and transportation."
31,CHAIR POWELL,"We are highly attentive to the risks that high inflation poses to both sides of our mandate, and we are strongly committed to restoring price stability."
32,CHAIR POWELL,"Against the backdrop of the rapidly evolving economic environment, our policy has been adapting, and it will continue to do so."
33,CHAIR POWELL,"At today’s meeting, the Committee raised the target range for the federal funds rate by ½ percentage point and stated that it “anticipates that ongoing increases in the target range will be appropriate.” We also decided to begin the process of reducing the size of our balance sheet, which will play an important role in firming the stance of monetary policy."
34,CHAIR POWELL,We are on a path to move our policy rate expeditiously to more normal levels.
35,CHAIR POWELL,"Assuming that economic and financial conditions evolve in line with expectations, there is a broad sense on the Committee that additional 50-basis-point increases should be on the table at the next couple of meetings."
36,CHAIR POWELL,We will make our decisions meeting by meeting as we learn from incoming data and the evolving outlook for the economy.
37,CHAIR POWELL,And we will continue to communicate our thinking as clearly as possible.
38,CHAIR POWELL,Our overarching focus is using our tools to bring inflation back down to our 2 percent goal.
39,CHAIR POWELL,"With regard to our balance sheet, we also issued our specific plans for reducing our securities holdings."
40,CHAIR POWELL,"Consistent with the principles we issued in January, we intend to significantly reduce the size of our balance sheet over time in a predictable manner by allowing the principal payments from our securities holdings to roll off the balance sheet, up to monthly cap amounts."
41,CHAIR POWELL,"For Treasury securities, the cap will be $30 billion per month for three months and May 4, 2022 will then increase to $60 billion per month."
42,CHAIR POWELL,"The decline in holdings of Treasury securities under Chair Powell’s Press Conference FINAL this monthly cap will include Treasury coupon securities and, to the extent that coupon securities are less than the monthly cap, Treasury bills."
43,CHAIR POWELL,"For agency mortgage-backed securities, the cap will be $17.5 billion per month for three months and will then increase to $35 billion per month."
44,CHAIR POWELL,"At the current level of mortgage rates, the actual pace of agency MBS runoff would likely be less than this monthly cap amount."
45,CHAIR POWELL,Our balance sheet decisions are guided by our maximum-employment and price-stability goals.
46,CHAIR POWELL,"And, in that regard, we will be prepared to adjust any of the details of our approach in light of economic and financial developments."
47,CHAIR POWELL,Making appropriate monetary policy in this uncertain environment requires a recognition that the economy often evolves in unexpected ways.
48,CHAIR POWELL,"Inflation has obviously surprised to the upside over the past year, and further surprises could be in store."
49,CHAIR POWELL,We therefore will need to be nimble in responding to incoming data and the evolving outlook.
50,CHAIR POWELL,And we will strive to avoid adding uncertainty to what is already an extraordinarily challenging and uncertain time.
51,CHAIR POWELL,We are highly attentive to inflation risks.
52,CHAIR POWELL,The Committee is determined to take the measures necessary to restore price stability.
53,CHAIR POWELL,The American economy is very strong and well positioned to handle tighter monetary policy.
54,CHAIR POWELL,"To conclude: We understand that our actions affect communities, families, and businesses across the country."
55,CHAIR POWELL,Everything we do is in service to our public mission.
56,CHAIR POWELL,We at the Fed will do everything we can to achieve our maximum-employment and price-stability goals.
57,CHAIR POWELL,"Thank you, and I look forward to your questions."
64,CHAIR POWELL,Thank you.
65,CHAIR POWELL,So you’re right—3.6 percent unemployment is just about as low as it’s been in 50 years.
66,CHAIR POWELL,"And I would say that I expect, and Committee members generally expect, that we’ll get some additional participation."
67,CHAIR POWELL,So people will be coming back into the labor force.
68,CHAIR POWELL,We’ve seen that particularly among prime-age people.
69,CHAIR POWELL,"And that will, of course, tend to hold the unemployment rate up a little bit."
70,CHAIR POWELL,"I would also expect, though, that job creation will slow."
71,CHAIR POWELL,"Job creation has been, you know, more than half a million per month in recent months—very, very strong, particularly for this stage of the economy."
72,CHAIR POWELL,"And so we think—with fiscal policy less supportive, with monetary policy less supportive, we think that job creation will slow as well."
73,CHAIR POWELL,So it is certainly possible that the unemployment would go down further.
74,CHAIR POWELL,But so I would expect those to be relatively limited because of the additional supply and also just the slowing in job creation.
75,CHAIR POWELL,"Implications for inflation—really, the wages matter a fair amount for companies, particularly in the service sector."
76,CHAIR POWELL,"Wages are running high, the highest they’ve run in quite some time."
77,CHAIR POWELL,"And they are one good example, or good illustration, really, of how tight the labor market really is, the fact that wages are running at the highest level in many decades."
78,CHAIR POWELL,And that’s because of an imbalance between supply and demand in the labor market.
79,CHAIR POWELL,"So we think through our policies—through further healing in the labor market, higher rates, for example, of vacancy filling and things like that, and more people coming back in—we’d like to think that supply and demand will come back into balance and that, therefore, wage inflation will moderate to still May 4, 2022 high levels of wage increases, but ones that are more consistent with 2 percent inflation."
80,CHAIR POWELL,That’s Chair Powell’s Press Conference FINAL our expectation.
83,CHAIR POWELL,So I guess I would say it this way: There’s a path.
84,CHAIR POWELL,"There’s a path by which we would be able to have demand moderate in the labor market and therefore have vacancies come down without unemployment going up, because vacancies are at such an extraordinarily high level."
85,CHAIR POWELL,"There’re 1.9 vacancies for every unemployed person, 11.5 million vacancies, 6 million unemployed people."
86,CHAIR POWELL,"So we haven’t been in that place on the vacancy, sort of the vacancy/unemployed curve, the Beveridge curve."
87,CHAIR POWELL,We haven’t been at that sort of level of a ratio in the modern era.
88,CHAIR POWELL,"So, in principle, it seems as though by moderating demand, we could see vacancies come down and, as a result—and they could come down fairly significantly and, I think, put supply and demand at least closer together than they are."
89,CHAIR POWELL,"And that would give us a chance to get inflation down, get wages down, and then get inflation down without having to slow the economy and have a recession and have unemployment rise materially."
90,CHAIR POWELL,So there’s a path to that.
91,CHAIR POWELL,"Now, I would say, I think we have a good chance to have a soft or softish landing or outcome, if you will."
92,CHAIR POWELL,And I’ll give you a couple of reasons for that.
93,CHAIR POWELL,"One is, households and businesses are in very strong financial shape."
94,CHAIR POWELL,"You’re looking at, you know, excess savings on balance sheets—excess in the sense that they’re substantially larger than the prior trend."
95,CHAIR POWELL,Businesses are in good financial shape.
96,CHAIR POWELL,"The labor market is, as I mentioned, very, very strong."
97,CHAIR POWELL,And so it doesn’t seem to be anywhere close to a downturn.
98,CHAIR POWELL,"Therefore, the economy is strong and is well positioned to handle tighter monetary policy."
99,CHAIR POWELL,"So, but I’ll say, I do expect that this May 4, 2022 will be very challenging; it’s not going to be easy."
100,CHAIR POWELL,"And it may well depend, of course, on events Chair Powell’s Press Conference FINAL that are not under our control."
101,CHAIR POWELL,"But our job is to use our tools to try to achieve that outcome, and that’s what we’re going to do."
114,CHAIR POWELL,Sure.
115,CHAIR POWELL,So a 75-basis-point increase is not something the Committee is actively considering.
116,CHAIR POWELL,"What we are doing is, we raised [the funds rate by] 50 basis points today."
117,CHAIR POWELL,"And we’ve said that, again, assuming that economic and financial conditions evolve in ways that are consistent with our expectations, there’s a broad sense on the Committee that additional 50-basis-point increases should be on the table for the next couple of meetings."
118,CHAIR POWELL,"So we’re going to make those decisions at the meetings, of course, and we’ll be paying close attention to the incoming data and the evolving outlook as well as to financial conditions."
119,CHAIR POWELL,"And, finally, of course, we will be communicating to the public about what our expectations will be as they evolve."
120,CHAIR POWELL,So the test is really just as I laid it out—economic and financial conditions evolving broadly in line with expectations.
121,CHAIR POWELL,"And, you know, I think expectations are that we’ll start to see inflation, you know, flattening out—and not necessarily declining yet, but we’ll see more evidence."
122,CHAIR POWELL,"We’ve seen some evidence that core PCE inflation is perhaps either reaching a peak May 4, 2022 or flattening out."
123,CHAIR POWELL,We’ll want to know more than just some evidence.
124,CHAIR POWELL,We’ll want to really feel Chair Powell’s Press Conference FINAL like we’re making some progress there.
125,CHAIR POWELL,"And we’re going to make these decisions, and there’ll be a lot more information."
126,CHAIR POWELL,I just think we want to see that information as we get there.
127,CHAIR POWELL,"It’s a very difficult environment to try to give forward guidance 60, 90 days in advance."
128,CHAIR POWELL,There are just so many things that can happen in the economy and around the world.
129,CHAIR POWELL,"So, you know, we’re leaving ourselves room to look at the data and make a decision as we get there."
131,CHAIR POWELL,I don’t think the one month is—no.
132,CHAIR POWELL,No.
133,CHAIR POWELL,One month’s reading doesn’t tell us much.
134,CHAIR POWELL,"You know, we‘d want to see evidence that inflation is moving in a direction that gives us more comfort."
135,CHAIR POWELL,"As I said, we’ve got two months now where core inflation is a little lower, but we’re not looking at that as a reason to take some comfort."
136,CHAIR POWELL,"You know, I think we need to really see that our expectation is being fulfilled—that inflation, in fact, is under control and starting to come down."
137,CHAIR POWELL,"But, again, it’s not like we would stop."
138,CHAIR POWELL,We would just go back to 25-basis-point increases.
139,CHAIR POWELL,It’ll be a judgment call when these meetings arrive.
140,CHAIR POWELL,"But, again, our expectation is, if we see what we expect to see, then we would have 50-basis-point increases on the table at the next two meetings."
147,CHAIR POWELL,So—neutral.
148,CHAIR POWELL,"When we talk about the neutral rate, we’re really talking about the rate that neither pushes economic activity higher nor slows it down."
149,CHAIR POWELL,"So it’s a concept, really."
150,CHAIR POWELL,It’s not something we can identify with any precision.
151,CHAIR POWELL,So we estimate it within broad bands of uncertainty.
152,CHAIR POWELL,And the current estimates on the Committee are sort of 2 to 3 percent.
153,CHAIR POWELL,"And also, that’s a longer-run estimate."
154,CHAIR POWELL,That’s an estimate for an economy that’s at full employment and 2 percent inflation.
155,CHAIR POWELL,"So, really, what we’re doing is, we’re raising rates expeditiously to what we see as the broad range of plausible levels of neutral."
156,CHAIR POWELL,But we know that there’s not a bright line drawn on the road that tells us when we get there.
158,CHAIR POWELL,"Our policy affects financial conditions, and financial conditions affect the economy."
159,CHAIR POWELL,So we’re going to be looking at the effect of our policy moves on financial conditions.
161,CHAIR POWELL,And then we’re going to be looking at the effects on the economy.
162,CHAIR POWELL,And we’re going to be making a judgment about whether we’ve done enough to get us on a path to restore price stability.
163,CHAIR POWELL,It’s that.
164,CHAIR POWELL,"So if that path happens to involve levels that are higher than estimates of neutral, then we will not hesitate to go to those levels."
165,CHAIR POWELL,We won’t.
166,CHAIR POWELL,"But, again, there’s a sort of false precision in the discussion that we as policymakers don’t really feel."
167,CHAIR POWELL,"You know, you’re going to raise rates, and you’re going to be kind of inquiring how that is affecting the economy through financial conditions."
168,CHAIR POWELL,"And, of course, if higher rates are required, then we won’t hesitate to deliver them."
175,CHAIR POWELL,"We don’t really see strong evidence of that yet, but that does not in any way make us comfortable."
176,CHAIR POWELL,"I think if you look at short-term inflation expectations, they’re quite elevated."
177,CHAIR POWELL,"And you can look at that and say, “Well, that’s because people expect inflation to come down.” And, in fact, inflation expectations [at longer horizons] come down fairly sharply."
178,CHAIR POWELL,"Longer-term inflation expectations have been reasonably stable but have moved up to—but only to levels where they were in 2014, by some measures."
179,CHAIR POWELL,So you can look at that.
180,CHAIR POWELL,And I think that’s a fair description of the picture.
181,CHAIR POWELL,But it’s really about the risks.
182,CHAIR POWELL,We don’t see a wage–price spiral.
183,CHAIR POWELL,"We see that companies have the ability to raise prices, and they’re doing that, but there have been price shocks."
184,CHAIR POWELL,"So I just think it takes you back to the basic point—was that we know we need to expeditiously move our policy rate up to ranges of more normal, neutral levels."
185,CHAIR POWELL,And we need to look around and keep going if we don’t see that financial conditions have tightened adequately or that the economy is behaving in ways that suggest that we’re not where we need to be.
186,CHAIR POWELL,"So, again, you don’t see those things yet, but I would say there’s no basis for feeling comfortable about that."
187,CHAIR POWELL,It’s a risk that we simply can’t run.
188,CHAIR POWELL,We can’t allow a wage–price spiral to happen.
189,CHAIR POWELL,And we can’t allow inflation expectations to become unanchored.
190,CHAIR POWELL,"It’s just something that we can’t allow to happen, and so we’ll look at it that way."
198,CHAIR POWELL,Well.
199,CHAIR POWELL,So our tools don’t really work on supply shocks.
200,CHAIR POWELL,Our tools work on demand.
201,CHAIR POWELL,"And to the extent we can’t affect, really, oil prices or other commodity prices or food prices and things like that, so we can’t affect those."
202,CHAIR POWELL,But there’s a job to do on demand.
203,CHAIR POWELL,"And that—you can see that in the labor market, where demand is substantially in excess of supply of workers."
204,CHAIR POWELL,And you can see it in the product markets as well.
205,CHAIR POWELL,But I guess I’m just pointing out that—a couple of things.
206,CHAIR POWELL,"For both the situation in Ukraine and the situation in China, they’re likely to, both, add to headline inflation."
207,CHAIR POWELL,"And people are going to be suffering from that, you know."
208,CHAIR POWELL,"People almost suffer more from food and energy shocks then, but—even though they don’t actually tell us much about the future path."
209,CHAIR POWELL,So the second thing is that they’re both capable of preventing further progress in supply chains healing or even making supply chains temporarily worse.
210,CHAIR POWELL,"So they’re going to weigh on the process of global supply chain healing, which is going to affect broader inflation, too."
211,CHAIR POWELL,"So, in a way, they’re two further negative shocks that have hit really in the last, you know, 60 days, 90 days."
218,CHAIR POWELL,"So, you know, I’ll just say: For now, we’re focused on doing the job we need to do on demand, and there’s plenty to be done there."
219,CHAIR POWELL,"Again, if you look at it, it’s essentially almost two to one, job vacancies to unemployed people."
220,CHAIR POWELL,There’s a lot of excess demand.
221,CHAIR POWELL,There’re more than 5 million more employed plus job openings than there are the size of the labor force.
222,CHAIR POWELL,So there’s an imbalance there that we have to do our work on.
223,CHAIR POWELL,"A very difficult situation—you know, you would look at core inflation, which wouldn’t include the commodity price shocks."
224,CHAIR POWELL,"And, you know, that’s one of the reasons we would tend to focus on that, because we can have more of an effect on that, but it would be a very difficult situation."
225,CHAIR POWELL,"I mean, we have to be sure that inflation expectations remain anchored."
226,CHAIR POWELL,"And I mean, that’s part of our job, too, so we’d be watching that carefully."
227,CHAIR POWELL,And it puts any central bank in a very difficult situation.
239,CHAIR POWELL,"Okay, so in terms of the vacancies-to-unemployment ratio, we don’t have a goal in mind."
240,CHAIR POWELL,"There’s no specific number that we’re saying, “We’ve got to get to that.” May 4, 2022 It’s really, you’ve got to get to a place where the labor market appears to be more in balance."
241,CHAIR POWELL,"Chair Powell’s Press Conference FINAL And that depends not only on the level of those things—it also, it depends on how well the matching functions in the labor markets are working."
242,CHAIR POWELL,"Because, you know, the longer these expansions go on, you can get very efficient with all of that, and the Beveridge curve shifts out."
243,CHAIR POWELL,"And that also tends to, you know, to help."
244,CHAIR POWELL,So there isn’t a specific number.
245,CHAIR POWELL,"I will say we were—you know, I think, I think when we got to one-to-one in the, you know, in the late teens, we thought that was a pretty good number."
246,CHAIR POWELL,"But, again, we’re not shooting for any particular number."
247,CHAIR POWELL,"What we’d like to see is progress, but we’re not really looking at that."
248,CHAIR POWELL,That’s an intermediate variable.
249,CHAIR POWELL,"We’re looking at wages, and we’re looking at, ultimately, inflation."
250,CHAIR POWELL,"So, you know, there are a bunch of channels through which policy works."
251,CHAIR POWELL,"You can think of it as, you know, interest-sensitive spending, and then you can think of another big one as asset values broadly."
252,CHAIR POWELL,"And, you know, there’re big models with, you know, a lot of different channels that are related to that."
253,CHAIR POWELL,"You know, we don’t focus on any one market—the equity market or the housing market—we focus on financial conditions broadly."
254,CHAIR POWELL,"So we wouldn’t be targeting any one market, as you suggest, for going up or down or taking a view on whether it’s at a good level or a bad level."
255,CHAIR POWELL,"We just would be looking at very broad measures of financial conditions—all the different financial conditions indexes, for example, which include equity."
256,CHAIR POWELL,"But they also include debt and other, many other things—credit spreads, things like that—too."
263,CHAIR POWELL,"So, first, the first thing to say is that we understand."
264,CHAIR POWELL,"And some of us are old enough to have lived through high inflation, and many aren’t."
265,CHAIR POWELL,But it’s very unpleasant.
266,CHAIR POWELL,"It’s just something people don’t—when they experience it for the first time, you’re paying more for the same thing."
267,CHAIR POWELL,"If you’re a normal economic person, then you probably don’t have that much extra to spend."
268,CHAIR POWELL,"And it’s immediately hitting your spending on groceries, on, you know, on gasoline, on energy, and things like that."
269,CHAIR POWELL,So we understand the pain involved.
271,CHAIR POWELL,"And it’s our job to make sure that inflation of that unpleasant, high nature doesn’t get entrenched in the economy."
272,CHAIR POWELL,"That’s what we’re here for, one of the main things we’re here for—perhaps the most fundamental thing we’re here for."
273,CHAIR POWELL,"And the way we do that is, we try to get supply and demand back in sync with each other, back in balance, so that the economy is under less stress and inflation will go down."
274,CHAIR POWELL,"Now, the process of getting there involves higher rates—so higher mortgage rates, higher borrowing rates, and things like that."
275,CHAIR POWELL,So it’s not going to be pleasant either.
276,CHAIR POWELL,"But in the end, everyone is better off."
